{
  "schema_version": 1,
  "kind": "raw",
  "device_id": "s22",
  "sha256": "d4e5f60718293a4b5c6d7e8f90a1b2c3d4e5f6a7b8c9d0e1f2a3b4c5d6e7f8a9",
  "start_utc": "2026-09-26T13:00:30.000Z",
  "duration_s": 7.5,
  "sample_rate": 16000,
  "run_id": "5e6f7a8b-9c0d-4e1f-8a2b-3c4d5e6f7a8b",
  "epoch": 0,
  "n_start": 1440000,
  "n_samples": 120000,
  "discontinuity": false,
  "clock_step": false,
  "clock_synced": true,
  "cut_reason": "shutdown",
  "edge_version": "android-0.1.0",
  "session_hint": null,
  "multi_speaker": null
}
