{
  "schema_version": 1,
  "device_id": "pi-home",
  "sha256": "0a1b2c3d4e5f60718293a4b5c6d7e8f90a1b2c3d4e5f6a7b8c9d0e1f2a3b4c5d",
  "start_utc": "2026-09-26T10:16:01.003Z",
  "duration_s": 30.0,
  "sample_rate": 16000,
  "run_id": "b0d0f1a2-3c4d-4e5f-8a9b-0c1d2e3f4a5b",
  "epoch": 1,
  "n_start": 1500000,
  "n_samples": 480000,
  "discontinuity": true,
  "clock_step": true,
  "clock_synced": false,
  "cut_reason": "cap",
  "vad": {"model": "silero-vad", "version": "v6.2.3", "threshold": 0.5},
  "edge_version": "0.1.0",
  "session_hint": null,
  "multi_speaker": null
}
